Discourse_Number,President_Terms,Full_Name,Political_Name,Term_Begins,Term_ends,Party,Party_abbreviation,Raise_to_power,Democratically_elected,Military,Period,doc_id,text
1,1,Manuel Deodoro da Fonseca,Deodoro da Fonseca,1889-11-15,1891-11-23,NA,NA,Coup,FALSE,TRUE,1,01_deodoro,"Concidadãos – O povo, o exército e a armada nacional, em perfeita comunhão de sentimentos com os nossos concidadãos residentes nas províncias, acabam de decretar a deposição da dinastia imperial e conseqüentemente a extinção do sistema monárquico representativo.
Como resultado imediato desta revolução nacional, de caráter essencialmente patriótico, acaba de ser instituído um governo provisório, cuja principal missão é garantir, com a ordem pública, a liberdade e os direitos dos cidadãos.
Para comporem esse governo, enquanto a nação soberana, pelos seus órgãos competentes, não proceder à escolha do governo definitivo, foram nomeados pelo chefe do poder executivo da nação os cidadãos abaixo assinados.
Concidadãos – O governo provisório, simples agente temporário da soberania nacional, é o governo da paz, da liberdade, da fraternidade e da ordem.
No uso das atribuições e faculdades extraordinárias de que se acha investido para a defesa da integridade da pátria e da ordem pública, o governo provisório, por todos os meios a seu alcance, permite e garante a todos os habitantes do Brasil, nacionais e estrangeiros, a segurança da vida e da propriedade, o respeito aos direitos individuais e políticos, salvas, quanto a estes, as limitações exigidas pelo bem da pátria e pela legitima defesa do governo proclamado pelo povo, pelo exército, pela armada nacional.
Concidadãos – As funções da justiça ordinária, bem como as funções da administração civil e militar, continuarão a ser exercidas pelos órgãos até aqui existentes, com relação aos ato na plenitude dos seus efeitos; com relação às pessoas, respeitadas as vantagens e os direitos adquiridos por cada funcionário.
Fica, porém, abolida, desde já, a vitaliciedade do senado e bem assim abolido o conselho de estado. Fica dissolvida a câmara dos deputados. 
Concidadãos – O governo provisório reconhece e acata todos os compromissos nacionais contraídos durante o regime anterior, os tratados subsistentes com as potências estrangeiras, a dívida pública externa e interna, os contratos vigentes e mais obrigações legalmente estatuídas."
2,1,Floriano Vieira Peixoto,Floriano Peixoto,1891-11-23,1894-11-15,NA,NA,Succeed,FALSE,TRUE,1,02_floriano,"Tendo assumido o governo do Estado nos termos da Constituição e por convite do generalíssimo Manoel Deodoro da Fonseca, que espontaneamente resignou o poder na manhã de 23 deste mês, cumpre-me expor ao País o pensamento geral que me ha de inspirar na administração pública.
São conhecidos os fatos que se realizaram nesta cidade e no seu porto durante a noite de 22 e na manhã do dia seguinte, precedidos de levantamento do heróico estado do Rio Grande do Sul, e atitude francamente hostil do estado do Pará. A armada, grande parte do exercito e cidadãos de diversas classes promoveram pelas armas o restabelecimento da Constituição e das leis suspensas pelo decreto de 3 deste mês, que dissolveu o Congresso Nacional. A historia registrará esse feito cívico das classes armadas do País em prol da lei, que não pode ser substituída pela força; mas ela registrará igualmente o ato de abnegação e patriotismo do generalíssimo Manoel Deodoro da Fonseca resignando o poder afim de poupar a luta entre irmãos, o derramamento do sangue de brasileiros, o choque entre os seus companheiros de armas, fatores gloriosos do imortal movimento de 15 de novembro, destinados a defender, unidos, a honra nacional e a integridade da pátria contra o estrangeiro e a defender e garantir a ordem e as instituições republicanas no interior do País.
Esses acontecimentos que não têm muitos modelos nos anais da humanidade e dos quais podemos nos gloriar, como justamente nos gloriamos das duas revoluções pacificas que operaram pela República a transformação de todo nosso direito político e pela abolição do elemento servil, a transformação do trabalho nacional atestarão aos vindouros o amor do povo, da marinha e do exército pelas liberdades constitucionais, que formam e enobrecem a vida das nações modernas.
O pensamento da revolução de 23 do corrente, que determinou a renúncia do generalíssimo Deodoro da Fonseca, foi o restabelecimento da Lei. Manter a inviolabilidade da Lei, que é ainda mais necessária nas sociedades democráticas, como um freio às paixões, do que mesmo nos governos absolutos pelas tradições de obediência pessoal, que os constituem, será para mim e meu governo sacratíssimo empenho, como sê-lo-á respeitar a vontade nacional e a dos Estados em suas livres manifestações sob o regime federal. Em respeito, pois, à lei fundamental e concretizando o pensamento da revolução triunfante, cumpro o dever de considerar nulo o ato de 3 deste mês, pelo qual foi dissolvido o Congresso Nacional, levantar o estado de sítio nesta capital e em Niterói e restabelecer todos os direitos e garantias constitucionais.
 A administração da fazenda pública com a mais severa economia e a maior fiscalização no emprego da renda do Estado será uma das minhas preocupações. Povos novos e onerados de dívidas nunca foram povos felizes, e nada aumenta mais as dívidas dos estados do que as despesas sem proporção com os recursos econômicos da nação, com as forças vivas do trabalho, das indústrias e do comércio, o que produz o desequilíbrio dos orçamentos, o mal-estar social, a miséria. Espero que, fiscalizada e economizada a fazenda pública, mantida a ordem no País, a paz com as nações estrangeiras sem quebra da nossa honra e dos nossos direitos, animado o trabalho agrícola e industrial e reorganizado o regime bancário, os abundantes recursos do nosso solo vaporizarão progressivamente o nosso meio circulante, depreciado para as permutas internacionais, e fortificarão o nosso crédito no interior e no exterior.
No governo do Estado, que foi-me conferido pela Constituição, confio da retidão de sua consciência para promover o bem da pátria. Da confiança do povo, do exercito e da marinha espero não desmerecer. Das forças de terra e mar conheço o valor realçado pela disciplina e pelo respeito aos direitos da sociedade civil. Admirei e admiro os meus bons companheiros na guerra e na paz.
A coragem e a constância que mostraram nos combates se transformaram nos anos de paz, que temos fruído, no amor da Liberdade e da República, que com o povo fundaram e com ele querem manter e consolidar. O povo que sabe e quer ser livre, deve igualmente respeitar a ordem, primeira condição da Liberdade e da riqueza.
Na grandiosa oficina em que se trabalha no progresso da pátria não há vencidos nem vencedores, grandes ou pequenos. São todos operários de uma obra comum. A essa obra dedicarei todo o meu esforço, para esse trabalho peço e espero o concurso de todos os brasileiros.
São estes os intuitos que me dominam, e que julguei dever expor ao País."
3,1,Prudente José de Morais Barros,Prudente de Morais,1894-11-15,1898-11-15,Partido Republicano Federal,PRF,Direct Election,TRUE,FALSE,1,03_prudente," Assumindo hoje a Presidência da República, obedeço à resolução da soberania nacional, solenemente enunciada pelo escrutínio de Io de Março.
 Aceitando este elevado cargo, que não pretendi por julgá-lo muito superior às minhas forças, especialmente na atual situação, submeto-me a imperioso dever patriótico, e não pouparei esforços nem sacrifícios para corresponder à extraordinária prova de confiança de meus concidadãos, manifestada de modo inequívoco no pleito eleitoral mais notável da vida nacional.
 Cumpre-me, neste momento, manifestar à nações quais os princípios e normas que me guiarão no desempenho da honrosa, mas difícil missão que me foi imposta.
 O lustro de existência, que hoje completa a República brasileira, tem sido de lutas quase permanentes com adversários de toda a espécie, que têm tentado destruí-la, empregando para isso todos os meios.
 Como expressão concreta desse período de funestas dissensões e lutas, rememoro com amargura a revolta de 6 de Setembro do ano próximo passado.
 Essa revolta, que foi o mais violento abalo de que se podia ressentir o regime proclamado a 15 de Novembro de 1889, iniciada sob o pretexto de defender a Constituição da República e de libertar a Pátria do jugo de uma suposta ditadura militar, reuniu, sob a sua bandeira, todos os elementos adversos à ordem e à paz pública, concluindo por caracterizar-se em um movimento formidável de ataque às instituições nacionais, arvorando o estandarte da restauração monárquica.
 Mas, por isso mesmo que essa luta tremenda foi travada pela coligação de todos os inimigos, a vitória da República foi decisiva para provar a estabilidade das novas instituições, que tiveram para defendê-las a coragem, a pertinácia e a dedicação do benemérito Chefe de Estado, auxiliado eficazmente pelas forças militares de terra e mar, – fiéis à Constituição a 6 de Setembro de 1893 – como a 23 de Novembro de 1891 ,– pelo concluso entusiasma da mocidade das escolas –, da guarda nacional, dos batalhões patrióticos e da polícia, e pela solidariedade unânime dos Estados da União, cujo apoio foi de extraordinário valor. Essa revolta que, durante tantos meses, –
substituindo a paz e o trabalho por lutas fratricidas, – perturbou a vida nacional e causou enormes males, danificando a fortuna publica e particular, produziu entretanto o grande beneficio de convencer ainda aos mais incrédulos de que a forma republicana, tal como está consagrada na Constituição de 24 de Fevereiro, é indubitavelmente a que tem de reger para sempre os destinos do Brasil, porque é no seu admirável mecanismo que está a mais segura garantia da harmonia permanente entre a unidade nacional e a vitalidade e expansão da forças locais.
 A República está, pois, firmada na consciência nacional; – lançou raízes tão fundas que jamais será daí arrancada.
 Ao passo que a monarquia caiu sem a menor resistência, não obstante haver dominado o país durante setenta anos com o seu regime centralizador, – a Republica, apesar de sua curta e perturbada existência, defendeu-se heroicamente e venceu a poderosa revolta restauradora, porque tinha a seu lado a opinião nacional, manifestada pelo consenso unânime dos Estados, que, havendo experimentado a influencia benéfica da autonomia, que lhes deu o novo regime, não se sujeitarão jamais à retrogradar á condição de províncias sem recursos, manietadas em seu desenvolvimento pelas peias atrofiantes da centralização.
 Os adversários das novas instituições devem estar desiludidos: segura pela poderosíssima ancora da federação, a República resistirá a todas as tempestades que contra ela se desencadeiem, por mais fortes e violentas que sejam.
 As constantes agitações que, no primeiro qüinqüênio, perturbaram a vida da República não causaram surpresa; eram previstas corno conseqüências da revolução de 15 de Novembro.
Não se realizam revoluções radicais, substituindo a forma de governo de uma nação, sem que nos primeiros tempos as novas instituições encontrem a resistência e os atritos, motivados pelos interesses feridos pela revolução, que embaraçam o funcionamento regular do novo regime.
Foi o que aconteceu ao Brasil.
 Felizmente, graças a altitude patriótica, pertinaz e enérgica do marechal Floriano Peixoto, secundado pela grande maioria da nação, – parece estar encerrado em nossa pátria o período das agitações, dos pronunciamentos e das revoltas, que lhe causaram danos inestimáveis, sendo muitos deles irreparáveis.
 Nesta situação, exige o patriotismo que todos os brasileiros, especialmente os depositários do poder publico, contribuam com seus esforços dedicados e perseverantes para conseguirem que a República seja o que deve ser – um regime de paz e de ordem, de liberdade e de progresso, sob o império da justiça e da lei.
 Essa é a ardente aspiração nacional, manifestada no escrutínio de I.o de Março, porque só assim será possível a reparação, ainda que lenta, dos danos sofridos pelo país.
 Na esfera de minhas atribuições esforçar-me-ei pela realização desse desideratum, observando estas normas e princípios
– Execução fiel do regime livre e democrático adotado pela constituição de 24 de Fevereiro, firmando e mantendo escrupulosamente a autonomia dos Estados harmônica com a soberania da União e a independência e o mutuo respeito dos poderes instituídos como órgãos d’essa soberania;
– Respeito ao exercício de todas as liberdades e garantias constitucionais, mantendo concorrente e energicamente a obediência à lei e o prestígio da autoridade, condições indispensáveis para assegurar a ordem e o progresso;
– Administração da Fazenda Pública com a máxima fiscalização na arrecadação e no emprego da renda e com a mais severa e perseverante economia, reduzindo a despesa de modo a equilibrá-la com a receita, extinguindo assim o déficit do orçamento, convertido este em realidade;
– Pontualidade na satisfação dos compromissos sucessivos, que desde passado remoto tem-se acumulado em ônus pesadíssimos a transmitirem-se de geração a geração; e resgate gradual da moeda fiduciária para elevar o seu valor depreciado;
– Animação à iniciativa particular para a exploração e desenvolvimento da agricultura e das indústrias, e introdução de imigrantes que, povoando o nosso vasto território, fecundem com o trabalho as suas riquezas inesgotáveis;
– Garantia eficaz à plena liberdade do sufrágio, base fundamental da democracia representativa;
– Manutenção da ordem e da tranqüilidade no interior e da paz com as nações estrangeiras, sem sacrifício de nossa dignidade e de nossos direitos, cultivando e desenvolvendo as relações com as nações amigas.
 Obedecendo a este programa, espero poder contribuir para o bem-estar e para a felicidade de nossa Pátria.
 Conheço e avalio bem os grandes embaraços e dificuldades de toda a ordem com que terei de lutar no desempenho de minha árdua missão; – desanimaria, se não me sentisse apoiado pela nação e se não contasse com a cooperação patriótica de cidadãos dos mais ilustrados e competentes.
 Como era fácil prever, os tristes acontecimentos a que aludi, tendo abalado e perturbado profundamente a vida nacional durante muitos meses, – agravaram bastante a nossa má situação política e financeira.
 Os germens da insubordinação e da anarquia expandiram-se e os compromissos do Tesouro foram grandemente aumentados com as despesas extraordinárias, que se tornaram indispensáveis.
 Mas, restabelecida a paz em condições de estabilidade, mantida a ordem no país – pelo respeito à lei e pelo prestígio da autoridade, restaurada a confiança do capital e do trabalho para promoverem a expansão da agricultura, das indústrias e do comércio, fiscalizada e severamente economizada a fazenda pública, – os inexauríveis recursos do nosso riquíssimo solo aliviarão progressivamente o Tesouro da opressão dos encargos atuais, valorizando correspondentemente o nosso meio circulante e erguendo no interior e no exterior o nosso crédito.
 É esse o caminho que nos levará com segurança à situação de prosperidade e grandeza a que está destinada a nossa Pátria.
O governo, que ora inicia a penosa jornada por esse caminho, fortalecido pelo apoio nacional, não se desviará dele, tendo por seus únicos e seguros roteiros – a justiça e a lei e por seu único alvo – a felicidade da Pátria."
